{
  "taskType": "single_tryon_plan",
  "taskGoal": "为女装主图整理单人换装方案",
  "usageScenario": "ecommerce_main_image",
  "subject": {
    "sourceType": "user_photo",
    "images": [
      {
        "label": "main-model",
        "url": "https://example.com/model.jpg",
        "note": "正面站姿，人物清晰"
      }
    ],
    "keepFeatures": [
      "face",
      "hair_style",
      "body_shape",
      "pose"
    ],
    "authorizationStatus": "confirmed"
  },
  "garment": {
    "category": "dress",
    "name": "黑色吊带连衣裙",
    "colors": [
      "black"
    ],
    "materials": [
      "satin"
    ],
    "pattern": "solid",
    "fit": "slim",
    "silhouette": "column",
    "visibleDetails": [
      "thin straps",
      "side slit",
      "smooth sheen"
    ],
    "mustKeep": [
      "dress length",
      "slit position"
    ],
    "notes": "用于电商主图，优先保持服装结构和人物身份"
  },
  "output": {
    "aspectRatio": "4:5",
    "deliverable": "prompt_draft",
    "variantCount": 1
  },
  "riskHints": [
    "确认画面不要被误写为真实试穿证明"
  ]
}
